,reviewId,userName,userImage,content,score,thumbsUpCount,reviewCreatedVersion,at,replyContent,repliedAt,appVersion
592,bdc16696-b881-412c-b51c-0484a148f6f4,Siti Nurafifah,https://play-lh.googleusercontent.com/a/ACg8ocJ-1NTyqjqaBxQ3udohxTSNeO2kzqqcZksQwTh1E_bunmelHg=mo,Bagus,4,0,3.24.14,2024-04-29 20:48:46,"Hi kak kalo kamu puas dengan apk shopee boleh ni ditambah 1 bintang lagi agar shopee kedepanya lebih baik. shopee akan berusaha memberikan yg terbaik untuk semua pengguna shopee, kalo ada pertanyaan/kendala Mohon hbgi kmi dgn memberikan screenshot review ini melalui DM ke Social Media kita @Shopee_id / @Shopeecare ya, have a nice day 🙏🏻^BA",2024-04-29 22:00:44,3.24.14
593,b7cda9e8-1e51-4380-a8b1-5a3e7b2a3f15,JASAD 666 GAMING,https://play-lh.googleusercontent.com/a-/ALV-UjXNrcmK2bwVQO__abpzr7lqVr6Dr7mKHI6-rDSUTZr-WlffPKtA,Kalo paylater bisa aktip nsnti bintang 5,2,1,3.24.17,2024-04-29 20:48:43,"Hi kak, maaf ya terkait Spaylater yg dinonaktifkan. Aku infoin hal tsb dikarena kebijakan dari PT. Commerce Finance. Mohon pastikan seluruh tagihan di Shopee telah lunas dan slalu jaga performa kredit ya kak. Jk kk msh terkendala bs lampirkan SS via Live Chat / DM ke Social Media kita @Shopee_id / @Shopeecare ya. Stay Safe🙏^HV",2024-04-29 21:49:41,3.24.17
594,17a3357a-0149-42d1-950a-2af82f36d4ce,Andi Aryadi,https://play-lh.googleusercontent.com/a-/ALV-UjWYyLAYf8S2UNVPxU-uEFyLrCCnDJxT4zXCLR_NwtKf9AGkCQk,"Semua ada di shopee, lengkap dan terpercaya",5,0,3.24.17,2024-04-29 20:48:31,"Hi kak, makasih ya buat 5 bintangnya moga shopee bisa selalu memberikan kenyamanan dalam kakak berbelanja. terus setia pake shopee kalo ada pertanyaan/kendala terkait shopee Mohon hubungi kami dengan memberikan screenshot review ini melalui Live Chat atau DM ke Social Media kita @Shopee_id / @Shopeecare ya, have a nice day 😊^BA",2024-04-29 22:00:11,3.24.17
595,22bfb5ec-f609-4cff-b608-04b10d5f2eae,Faris Xtm258,https://play-lh.googleusercontent.com/a-/ALV-UjVijLfn2IAMPsB-6G5HS9n7FPUTuXvhsYfHdKg-wYEX-8vFHA,I like this,5,0,3.24.14,2024-04-29 20:48:23,"Hai kak, terima kasih banyak ya kak atas rating dan reviewnya. Mimin tambah semangat buat kasih pelayanan yg terbaik :) Jika kamu ada pertanyaan, bisa lampirkan SS review ini melalui Live Chat atau DM ke Social Media kita @Shopee_id / @Shopeecare ya. Have a nice day 😊^HV",2024-04-29 21:48:22,3.24.14
596,e8a9f7dc-240b-4644-81f4-20758b1e4829,restu amri,https://play-lh.googleusercontent.com/a-/ALV-UjV8IyU5c-tk7tEQ3lvz9emyt-08qLXjAU3C6AvKHNowk5uUaRo,top,5,0,3.23.36,2024-04-29 20:47:58,"Hi kak, makasih ya buat 5 bintangnya moga shopee bisa selalu memberikan kenyamanan dalam kakak berbelanja. terus setia pake shopee kalo ada pertanyaan/kendala terkait shopee Mohon hubungi kami dengan memberikan screenshot review ini melalui Live Chat atau DM ke Social Media kita @Shopee_id / @Shopeecare ya, have a nice day 😊^BA",2024-04-29 21:59:36,3.23.36
597,1315239f-578b-4607-866f-72b9c5b67261,Faisal Ahmad Nugraha,https://play-lh.googleusercontent.com/a-/ALV-UjVQ57JuSD6I3-vfDL0Modc7BT0EPXkPS6o5sCMUauPHoRjXcwUi,Bagus untuk membeli barang,5,0,,2024-04-29 20:47:03,"Hai kak, terima kasih banyak ya kak atas rating dan reviewnya. Mimin tambah semangat buat kasih pelayanan yg terbaik :) Jika kamu ada pertanyaan, bisa lampirkan SS review ini melalui Live Chat atau DM ke Social Media kita @Shopee_id / @Shopeecare ya. Have a nice day 😊^HV",2024-04-29 21:47:32,
598,1884f683-5a5f-4929-9d4e-e09bd00423fd,Hilyatul Bahiyyah,https://play-lh.googleusercontent.com/a-/ALV-UjXLacYqQq_s-7R2j0lpKmC_L-u9_kcNaFOG7qcCA16JZpISdMHp,Puas belanja di shopee,5,0,3.24.14,2024-04-29 20:45:45,"Mantap kak, mimin ikut seneng kalau km puas belanja di Shopee, makasih yaw kak untuk bintang 5 nya. Moga Shopee bisa selalu jd tempat belanja yg terpercaya jd km makin nyaman menggunakan aplikasinya. Jk km ada pertanyaan, bisa lampirkan SS review ini melalui Live Chat atau DM ke Social Media kita @Shopee_id / @Shopeecare ya. Sehat Selalu🧡^HV",2024-04-29 21:46:35,3.24.14
599,f14e46c7-f13c-4537-babf-f24e99d19f4d,Arifin Sena,https://play-lh.googleusercontent.com/a-/ALV-UjUBfKcMaA0DQJ9XsIrtKWCgjEECfbl_GoUACttVkd94G_tJtzw,"Driver shopee food nya lama, selalu dapet driver yg bareng pesanan orang lain .. knpa bisa bertumpuk2 gitu?? Makanan kita jadi dingin karena driver nya. Tolong dong min di benahi untuk aturan si driver nyaa",1,0,2.85.32,2024-04-29 20:43:43,"hi kak, maaf ya udah buat kamu ga nyaman terkait kendala kamu. agar dapat mimin bantu cek boleh infoin detail kendala kamu ke mimin ya kak. Mohon hubungi mimin dengan memberikan screenshot review ini melalui DM ke Social Media kita @Shopee_id / @Shopeecare ya, have a nice day 🙏^BA",2024-04-29 21:58:11,2.85.32
600,99a8c43c-2a7c-458c-a92a-d339e2d200da,Azam Pratama,https://play-lh.googleusercontent.com/a/ACg8ocJlAg_7-U165i16btTLwVqwEgTQN1fFb-tMEj8kEUznWL6UvA=mo,Bagus,5,0,2.80.30,2024-04-29 20:43:00,"Hai kak, terima kasih banyak ya kak atas rating dan reviewnya. Mimin tambah semangat buat kasih pelayanan yg terbaik :) Jika kamu ada pertanyaan, bisa lampirkan SS review ini melalui Live Chat atau DM ke Social Media kita @Shopee_id / @Shopeecare ya. Have a nice day 😊^HV",2024-04-29 21:45:24,2.80.30
601,cfdc6052-cbad-4a00-82ad-2aa94b1b5434,Dwi Ayu soraya,https://play-lh.googleusercontent.com/a/ACg8ocL2g5TTVPLcQmh4j69PgUXYm2CXSfLwQD50jybfslCcvXTO2A=mo,aplikasi bagus,5,0,3.24.17,2024-04-29 20:40:32,"Hi kak, makasih ya buat 5 bintangnya moga shopee bisa selalu memberikan kenyamanan dalam kakak berbelanja. terus setia pake shopee kalo ada pertanyaan/kendala terkait shopee Mohon hubungi kami dengan memberikan screenshot review ini melalui Live Chat atau DM ke Social Media kita @Shopee_id / @Shopeecare ya, have a nice day 😊^BA",2024-04-29 21:59:06,3.24.17
602,6d4b3928-4825-4fb5-9809-d0f0c97c2a85,Yuni Wahyuni,https://play-lh.googleusercontent.com/a/ACg8ocLSwjxSBjtXQMJ298AqgL24t3vqMcECvw5A2KpNs9IAJsDV2g=mo,Sangat memuaskan,5,0,3.24.14,2024-04-29 20:40:12,"Hi kak, makasih ya buat 5 bintangnya moga shopee bisa selalu memberikan kenyamanan dalam kakak berbelanja. terus setia pake shopee kalo ada pertanyaan/kendala terkait shopee Mohon hubungi kami dengan memberikan screenshot review ini melalui Live Chat atau DM ke Social Media kita @Shopee_id / @Shopeecare ya, have a nice day 😊^BA",2024-04-29 21:57:33,3.24.14
603,2d251ea3-39d9-4d59-a30f-fa31c787b493,Cahaya Electric,https://play-lh.googleusercontent.com/a-/ALV-UjWFRJArl0QYY7Dz1SIQrE9Ief9BDn3loaujLKZWUVcFAVxi5VI,Aplikasi nya terkadang sering lambat kalu back..,3,0,,2024-04-29 20:39:24,"Hai kak, maaf yaw udah buat ga nyaman, terkait kendala kamu, mimin infoin kamu bisa clear cache aplikasi kamu, pastiin udah update ke versi terbaru, jaringan internet kamu stabil dan coba secara berkala yaw kak,kalau masih berkendala, jangan sungkan untuk colek mimin ke DM IG @shopee_id ya ka. Stay safe 😊^WS",2024-03-26 15:02:07,
604,0bea96f4-0996-424d-aebf-abc74fcf26fb,Mikael Mik,https://play-lh.googleusercontent.com/a/ACg8ocLU19Cqzcz3T1U6Piv-j-bsr9QONN1UYhyU_0oXBPzUK2dXRg=mo,Sangat terbantu dgn shopee,5,0,3.24.17,2024-04-29 20:37:47,"Hai kak, makasih utk reviewnya. Mimin seneng deh kalo Shopee bs membantu kamu. Semoga Shopee selalu bs kasih pengalaman belanja terbaik utk kamu. Yuk kepoin promo-promo seru di aplikasi Shopee. Kalau kaka ada pertanyaan, bisa lampirkan SS review ini via Live Chat atau DM ke Social Media kita @Shopee_id / @Shopeecare ya. Sehat Selalu 😊^HV",2024-04-29 21:44:30,3.24.17
605,5da72545-7066-4a7e-9b12-88ce215c684f,Hi Fatimah,https://play-lh.googleusercontent.com/a-/ALV-UjUjwi4F6iG1Ci5y56R6OK76XkAWe8eyyb3g0u-5qr5hqPa994E,"Shoope lagi error kah? Kok ga bisa di download, saya sudah pernah download shoope sebelumnya dan tidak pernah ada kejadian error. Terus semenjak adek ku menghapus shopee, saya lanjut download lalu masih gabisa saya udah coba selama 2 hari ini. Ada apa dengan shopee? Tolong saran nya.",1,0,3.24.14,2024-04-29 20:35:06,"hi kak, maaf ya udah buat kamu ga nyaman terkait kendala kamu. agar dapat mimin bantu cek boleh infoin detail kendala kamu ke mimin ya kak. Mohon hubungi mimin dengan memberikan screenshot review ini melalui DM ke Social Media kita @Shopee_id / @Shopeecare ya, have a nice day 🙏^BA",2024-04-29 21:56:39,3.24.14
606,bdf74928-2fef-4403-9527-55214294bb0d,Laras Oktaviani,https://play-lh.googleusercontent.com/a/ACg8ocIh5nzmhdFWCny9yM-OFTTLgkKPhft-Wuf2MRELoNY67dtpp_s=mo,"Parah banget shopee masa Paylater sama Spinjam di nonaktifkan, padahal tadinya berfungsi dengan baik. Pas lunas semua malah dinonaktifkan. Gajelas",2,0,3.17.23,2024-04-29 20:35:00,"Hi kak, maaf ya terkait Spaylater & Spinjam yg dinonaktifkan. Aku infoin hal tsb dikarena kebijakan dari PT. Commerce Finance. Mohon pastikan seluruh tagihan di Shopee telah lunas dan slalu jaga performa kredit ya kak. Jk kk msh terkendala bs lampirkan SS via Live Chat / DM ke Social Media kita @Shopee_id / @Shopeecare ya. Stay Safe🙏^HV",2024-04-29 21:40:28,3.17.23
607,7d5736d2-f3da-40c3-b489-a5ec3bc79438,Rendy Nizarwan,https://play-lh.googleusercontent.com/a-/ALV-UjVfaaygwQpIYTkTU3PHuNFvvqS7cvUIzxG7jSnzY2gJijWo-4cX,Nice,5,0,3.24.14,2024-04-29 20:34:40,"Hi kak, makasih ya buat 5 bintangnya moga shopee bisa selalu memberikan kenyamanan dalam kakak berbelanja. terus setia pake shopee kalo ada pertanyaan/kendala terkait shopee Mohon hubungi kami dengan memberikan screenshot review ini melalui Live Chat atau DM ke Social Media kita @Shopee_id / @Shopeecare ya, have a nice day 😊^BA",2024-04-29 21:51:10,3.24.14
608,d63250d8-7453-4812-9a69-0ac0fba57a7a,Nafisa Salma,https://play-lh.googleusercontent.com/a/ACg8ocJr8yllncaA434YcybkOTyJCL0LgxNEwrYA6ebeX_xFJzxsHg=mo,", Bagus",5,0,,2024-04-29 20:34:11,"Hai kak, terima kasih banyak ya kak atas rating dan reviewnya. Mimin tambah semangat buat kasih pelayanan yg terbaik :) Jika kamu ada pertanyaan, bisa lampirkan SS review ini melalui Live Chat atau DM ke Social Media kita @Shopee_id / @Shopeecare ya. Have a nice day 😊^HV",2024-04-29 21:38:36,
609,0832dc65-d685-4463-93c8-b5966b149297,Cacu Mks,https://play-lh.googleusercontent.com/a/ACg8ocLclOOd6u6e-nedsmg3XRI2HVPm1-fhClEq7c-BbfDfc9laDg=mo,🤓☝️,2,0,,2024-04-29 20:31:42,"Hai kak, jika kamu ada kendala/pertanyaan terkait shopee Mohon hubungi kami dengan memberikan screenshot review ini melalui Live Chat atau DM ke Social Media kita @Shopee_id / @Shopeecare ya, have a nice day 🙏🏻^BA",2024-04-29 22:32:29,
610,1bb3f56b-47af-445e-bbd6-283e843ce5d9,Dwi Hariyanti,https://play-lh.googleusercontent.com/a/ACg8ocIuXROfU916chdABt5H3Yw46B2lCwD16Fc24rBo2YjBKN8T2g=mo,Aplikasi belanja paling lengkap recomen buat belanja segala macam kebutuhan kita. .. mantap 👍,5,0,3.24.17,2024-04-29 20:30:36,"Mantap kak, mimin ikut seneng kalau km puas belanja di Shopee, makasih yaw kak untuk bintang 5 nya. Moga Shopee bisa selalu jd tempat belanja yg terpercaya jd km makin nyaman menggunakan aplikasinya. Jk km ada pertanyaan, bisa lampirkan SS review ini melalui Live Chat atau DM ke Social Media kita @Shopee_id / @Shopeecare ya. Sehat Selalu🧡^HV",2024-04-29 21:23:54,3.24.17
611,4d53b731-3d18-4600-83f9-62e6b3404d3d,Rian Miftahul Rizky,https://play-lh.googleusercontent.com/a-/ALV-UjVE2Z374rGLO39n7waYCsM6efp63QfUscdPeuulKWF20CfkOvF3,ngadain event 5.5 voucher kaget tapi setiap mau masuk event nya cuma putih doang gabisa di klaim hadeh,3,0,3.24.17,2024-04-29 20:27:54,"Hallo kak, maaf ya kak udah bikin ga nyaman. Shopee selalu berupaya untuk meningkatkan pelayanan kepada pengguna maupun ke penjual yah kak dan akan selalu berusaha memberikan yang terbaik. Jika kakak ada kendala mengenai Shopee untuk detailnya jangan sungkan buat japri aku ke IG DM @shopee_id yah kak. Mimin tunggu 🙏 ^IL",2024-04-29 19:31:35,3.24.17
612,2f13a474-37a7-449e-bebf-e8a0ccb138d8,Rizki Maulana,https://play-lh.googleusercontent.com/a/ACg8ocIFFGsHhtdw4vY2YdB47M4ilm_r5kkNvSNtAkjI5ScXPi-Z=mo,"Aneh sekarang berandanya, diklik yg keluar video setelah diklik barang ternyata beda sama yg divideo. Skrng kalo mau buka barang harus doble klik kalo masih diberanda. Repot bett",1,0,3.24.17,2024-04-29 20:27:20,"hi kak, maaf ya udah buat kamu ga nyaman terkait kendala kamu. agar dapat mimin bantu cek boleh infoin detail kendala kamu ke mimin ya kak. Mohon hubungi mimin dengan memberikan screenshot review ini melalui DM ke Social Media kita @Shopee_id / @Shopeecare ya, have a nice day 🙏^BA",2024-04-29 22:29:20,3.24.17
613,67818564-2ab4-42c9-90c7-36168d5b710e,Werpianti Galla,https://play-lh.googleusercontent.com/a/ACg8ocIJuu1R1Nn_EmbRuL_qFlwspTkOQwak9lmQm9y4Mb4MxEDOtQ=mo,Sangat bgus pelayanannya,5,0,3.24.14,2024-04-29 20:26:54,"Hai kak, terima kasih banyak ya kak atas rating dan reviewnya. Mimin tambah semangat buat kasih pelayanan yg terbaik :) Jika kamu ada pertanyaan, bisa lampirkan SS review ini melalui Live Chat atau DM ke Social Media kita @Shopee_id / @Shopeecare ya. Have a nice day 😊^HV",2024-04-29 21:23:13,3.24.14
614,616b0457-aaf0-4e85-afd2-6a5c7d9af32b,BlommmXD_,https://play-lh.googleusercontent.com/a-/ALV-UjXFjOVPiJvInDyCd7vfVIvHRCVBIzHyqGKvb4IJas9zOnDFO14,"jangan kau buat tren menjadi alasan....................... kau .......... membuat iklan yg mengganggu mungkin bagi user apple gak trlalu ngaruh tapi bagi user andro ram 4 kebawah ituu menjadi masalah LAIN KALI GA USAH SPAM IKLAN GW DAH MUAK SAMA IKLAN LU, BIKIN IKLAN SI BIKIN TAPI GA USH SPAM",1,0,3.24.17,2024-04-29 20:26:21,Hai kak. Mohon maaf atas ketidaknyamannnya. Terkait hal tersebut bertujuan agar kamu tidak ketinggalan update promo menarik dari shopee ya kak. Mohon hubungi kami dengan memberikan screenshot review ini melalui Live Chat atau DM ke Social Media kita @Shopee_id / @Shopeecare ya ^RS,2023-03-20 22:31:52,3.24.17
615,954207ec-41cb-4664-8a5d-8b26cc414d24,Murdowo Vr,https://play-lh.googleusercontent.com/a/ACg8ocL7uxhfJS_7WwGnTNOR9qZOwIeXZfZsOsFrztSjFtS6ose7xA=mo,Shopee baik,5,0,3.09.20,2024-04-29 20:26:04,"makasih ya kak untuk bintang dan reviewnya, nikmatin terus promo2 menarik di shopee ya kak, kalo nanti kamu mengalami kendala bisa kabarin aku di Live chat di aplikasi shopee ya. terima kasih 😊 ^XS",2023-01-20 15:07:44,3.09.20
616,9ad5139f-a9bc-4a4a-bf36-f2cd63542933,Doni Saputra,https://play-lh.googleusercontent.com/a-/ALV-UjVKVb0s-vJed3iuN18reChne5VN0Zr-txJYk9FFGL1YkgcJOHDV,Aplikasi nya sangat baik 👍👏👉📱,5,0,3.24.14,2024-04-29 20:25:51,"Hi kak, makasih ya buat 5 bintangnya moga shopee bisa selalu memberikan kenyamanan dalam kakak berbelanja. terus setia pake shopee kalo ada pertanyaan/kendala terkait shopee Mohon hubungi kami dengan memberikan screenshot review ini melalui Live Chat atau DM ke Social Media kita @Shopee_id / @Shopeecare ya, have a nice day 😊^BA",2024-04-29 22:26:59,3.24.14
617,b86a2b98-1f50-4539-9ae9-ec6bee37dad9,Oppo Malang,https://play-lh.googleusercontent.com/a/ACg8ocJcY_oKUa7vXzc2sw2mrR4XmuhRF551gGEHxvrvAn1t9BdDkQ=mo,Yaaahh mantap,5,0,3.24.14,2024-04-29 20:25:09,"Hi kak, makasih ya buat 5 bintangnya moga shopee bisa selalu memberikan kenyamanan dalam kakak berbelanja. terus setia pake shopee kalo ada pertanyaan/kendala terkait shopee Mohon hubungi kami dengan memberikan screenshot review ini melalui Live Chat atau DM ke Social Media kita @Shopee_id / @Shopeecare ya, have a nice day 😊^BA",2024-04-29 22:25:12,3.24.14
618,471f38a5-a1b3-4726-b480-17e4ea3916bc,khalid dzakwan,https://play-lh.googleusercontent.com/a-/ALV-UjW16boCKe6kgCGMXjy9SqntkIMOfjun4P_dcButcIHOst5k90BLFA,"Untuk aplikasi ini masih ada banyak Bug, tapi kalau soal toko lumayan tapi ada saja mengecewakannya 👍🏻",3,0,2.69.20,2024-04-29 20:24:25,"Hi kak, mohon maaf terkait kendalanya. Pastikan aplikasi kamu versi terbaru, Clear Cache, Logout dan Login kembali dan pastikan jaringan stabil, cek secara berkala 1x24 jam. Jika masih berkendala bisa lampirkan SS review ini melalui Live Chat atau DM ke Social Media kita @Shopee_id / @Shopeecare ya. Stay Safe🙏 ^HV",2024-04-29 21:22:00,2.69.20
619,bbbdd2de-df3b-4ecf-9f4d-ebbf56b7a019,Mas Yanto Enjoy Aja,https://play-lh.googleusercontent.com/a-/ALV-UjWIFyC60kxNjsvnyOON-agZvM3F1Gr4ueC3r7FORV0vHInxmpE2,Error mati matian melulu,3,0,,2024-04-29 20:23:56,"hi kak, maaf ya udah buat kamu ga nyaman terkait kendala kamu. agar dapat mimin bantu cek boleh infoin detail kendala kamu ke mimin ya kak. Mohon hubungi mimin dengan memberikan screenshot review ini melalui DM ke Social Media kita @Shopee_id / @Shopeecare ya, have a nice day 🙏^BA",2024-04-29 22:26:09,
620,66e4849a-8b2e-482f-8d4e-661b2619f7fa,MJ,https://play-lh.googleusercontent.com/a-/ALV-UjVgUVTrq22BhrrWWjhFQZoCh20q5lPFP_POokWWawgZW2_MsNw,Good,5,0,,2024-04-29 20:22:46,"Hai kak, terima kasih banyak ya kak atas rating dan reviewnya. Mimin tambah semangat buat kasih pelayanan yg terbaik :) Jika kamu ada pertanyaan, bisa lampirkan SS review ini melalui Live Chat atau DM ke Social Media kita @Shopee_id / @Shopeecare ya. Have a nice day 😊^HV",2024-04-29 21:21:14,
621,bc8c05da-4ef6-4d75-aa39-8be529882f4c,Nurika aura,https://play-lh.googleusercontent.com/a/ACg8ocJupXz8cotWB7aG3v7k7HwrfhxxjNEIpN2n4i2w2b6QLnagFw=mo,bagus,5,0,,2024-04-29 20:21:27,"Hi kak, makasih ya buat 5 bintangnya moga shopee bisa selalu memberikan kenyamanan dalam kakak berbelanja. terus setia pake shopee kalo ada pertanyaan/kendala terkait shopee Mohon hubungi kami dengan memberikan screenshot review ini melalui Live Chat atau DM ke Social Media kita @Shopee_id / @Shopeecare ya, have a nice day 😊^BA",2024-04-29 22:24:40,
622,7e3b5a2e-9153-4a5a-bbea-2cc05d2bdd03,Farid Saja,https://play-lh.googleusercontent.com/a-/ALV-UjXQLSzijulo2kvsr9rdddVwPmdjqVqsG9srzpQrIf_eXY2f6WI,Sangat mmbantu d saat mager,5,0,3.24.14,2024-04-29 20:19:55,"Hai kak, makasih utk reviewnya. Mimin seneng deh kalo Shopee bs membantu kamu. Semoga Shopee selalu bs kasih pengalaman belanja terbaik utk kamu. Yuk kepoin promo-promo seru di aplikasi Shopee. Kalau kaka ada pertanyaan, bisa lampirkan SS review ini via Live Chat atau DM ke Social Media kita @Shopee_id / @Shopeecare ya. Sehat Selalu 😊^HV",2024-04-29 21:20:42,3.24.14
623,01b5e695-ca0c-4d2c-b6ae-6f1c9faf5c2b,Desvina Amelia,https://play-lh.googleusercontent.com/a/ACg8ocI6iBcEkWBW3DY9uL8S7IqduL9kaVbQZGTEmsZGEuIu3wCeqw=mo,"PARAH SHOPEE FOOD, semenjak driver ambil lebih dari 1 orderan nasi saya jadi dingin, tolong kembalikan layanan lama 1 driver 1 orderan makanan !!!",1,0,,2024-04-29 20:18:32,"hi kak, maaf ya udah buat kamu ga nyaman terkait kendala kamu. agar dapat mimin bantu cek boleh infoin detail kendala kamu ke mimin ya kak. Mohon hubungi mimin dengan memberikan screenshot review ini melalui DM ke Social Media kita @Shopee_id / @Shopeecare ya, have a nice day 🙏^BA",2024-04-29 22:24:01,
624,b651e911-497a-4d61-a97f-f10ad0921be4,Fatia Rahmatus Sania,https://play-lh.googleusercontent.com/a/ACg8ocLu5jXhyqNTm8kaqiHJQAQmP65T1DL11xN6hr3YeEdUKCZzRQ=mo,Cs nya mantullll,5,0,3.24.17,2024-04-29 20:18:08,"Hai kak, terima kasih banyak ya kak atas rating dan reviewnya. Mimin tambah semangat buat kasih pelayanan yg terbaik :) Jika kamu ada pertanyaan, bisa lampirkan SS review ini melalui Live Chat atau DM ke Social Media kita @Shopee_id / @Shopeecare ya. Have a nice day 😊^HV",2024-04-29 21:20:18,3.24.17
625,2233eb1d-c365-4806-b219-d13141ce7297,Ahmad husyin akbar Akbar,https://play-lh.googleusercontent.com/a/ACg8ocIk1mDUhfN9a35PqD9lMFbbWwKCM0Gf3yUqB1RE21nurtkDRg=mo,Terkadang saya suka untuk membili lewat Shopee karna harga yang cukup terjangkau namun saya juga sering kecewa dengan barang yang saya pesan tidak realpict.lebih tempatx sesuai harga.harusnya katakan saja harga yang sebenarnya jangan memanipulasi barang ORI dengan yg kw.,3,2,3.21.16,2024-04-29 20:16:42,"hi kak, maaf ya udah buat kamu ga nyaman terkait kendala kamu. agar dapat mimin bantu cek boleh infoin detail kendala kamu ke mimin ya kak. Mohon hubungi mimin dengan memberikan screenshot review ini melalui DM ke Social Media kita @Shopee_id / @Shopeecare ya, have a nice day 🙏^BA",2024-04-29 22:23:24,3.21.16
626,ea139fa6-7c0f-4f66-b477-5816ee489897,Rahmawirna Muis,https://play-lh.googleusercontent.com/a/ACg8ocKfwRA1ZHbS5Co58rdkj9LFvleBNiHEvaeSN2FC3zHrOJOPkn3r=mo,Keren,5,0,3.23.36,2024-04-29 20:16:00,"Hai kak, terima kasih banyak ya kak atas rating dan reviewnya. Mimin tambah semangat buat kasih pelayanan yg terbaik :) Jika kamu ada pertanyaan, bisa lampirkan SS review ini melalui Live Chat atau DM ke Social Media kita @Shopee_id / @Shopeecare ya. Have a nice day 😊^HV",2024-04-29 21:19:50,3.23.36
627,3c1f97b6-4f56-486d-865d-8c514341bca5,Haekal Kevin,https://play-lh.googleusercontent.com/a/ACg8ocJqz0N9M7xWs8wHsS-w81ewJ0XoyFspYuhkNRsB07NAvkqtaQ=mo,Bagus sih aplikasinya,5,0,3.24.17,2024-04-29 20:15:52,"Hi kak, makasih ya buat 5 bintangnya moga shopee bisa selalu memberikan kenyamanan dalam kakak berbelanja. terus setia pake shopee kalo ada pertanyaan/kendala terkait shopee Mohon hubungi kami dengan memberikan screenshot review ini melalui Live Chat atau DM ke Social Media kita @Shopee_id / @Shopeecare ya, have a nice day 😊^BA",2024-04-29 22:19:34,3.24.17
628,b3c0e4cf-c67d-4b83-9c5a-7ad5757df754,Suma Suma,https://play-lh.googleusercontent.com/a/ACg8ocIokV3PuOSsw4RnYA4RIleQ67_Jxxj1pT69g2ouo8BEIuEVVw=mo,shopee memang pas buat blanja dan mmbantu👍👍,4,0,3.20.10,2024-04-29 20:15:37,"Hallo kak, terima kasih banyak ya kak atas rating dan review nya, mimin tambah seneng banget nih klo bintangnya tambah lagi :) Kalo ada kendala terkait Shopee bisa lampirkan SS review ini melalui Live Chat atau DM ke Social Media kita @Shopee_id / @Shopeecare ya. Sehat Selalu😊^HV",2024-04-29 21:18:29,3.20.10
629,0eb42fa9-5b7f-4024-b8b3-3ba9eb1cc88a,Aba Haris,https://play-lh.googleusercontent.com/a-/ALV-UjXZpcYor_I9btMKvippcwFAt5zV1t8SVMuZ1UD7snTi_985IIQ,mantap super,5,0,3.22.50,2024-04-29 20:13:36,"Hi kak, makasih ya buat 5 bintangnya moga shopee bisa selalu memberikan kenyamanan dalam kakak berbelanja. terus setia pake shopee kalo ada pertanyaan/kendala terkait shopee Mohon hubungi kami dengan memberikan screenshot review ini melalui Live Chat atau DM ke Social Media kita @Shopee_id / @Shopeecare ya, have a nice day 😊^BA",2024-04-29 22:18:59,3.22.50
630,b2705cf0-33ff-4039-b17c-a47e7f3b9ecb,Rusni Rusni,https://play-lh.googleusercontent.com/a/ACg8ocK5subSNYj0oaphWJM_Y1dHvyzBwS3QbUwMgQWYjxgskqgh7g=mo,"Sya sangat puas ketika berbelanja di Shopee, krn harganya lumayan dan juga kualitasnya bgus.",5,0,3.23.36,2024-04-29 20:13:27,"Hi kak, makasih ya udah kasih review buat Shopee. Klo kamu suka sama aplikasinya boleh dong ditambah utk bintangnya hihi. Pantengin juga sosial media Shopee karena banyak info terbaru dan keseruan yang menanti kamu nih. Oia kalo kamu punya pertanyaan atau kendala terkait Shopee bisa juga loh DM mimin ke IG @ShopeeCare_id . Stay safe ❤ ^MC",2024-04-27 07:33:59,3.23.36
631,b212822a-0e1a-42c5-b109-7654299e557a,Helen Sopandi,https://play-lh.googleusercontent.com/a-/ALV-UjUzJ1QOBzmoPsZQcKF0fg6AjBbPmpUhW5EdTGuwPVSraB7HTG7S,ok harus d perbanyak gratis ongkir biar lanjut terus belanja d Shopee,4,0,3.20.10,2024-04-29 20:13:26,"Hallo kak, terima kasih banyak ya kak atas rating dan review nya, mimin tambah seneng banget nih klo bintangnya tambah lagi :) Kalo ada kendala terkait Shopee bisa lampirkan SS review ini melalui Live Chat atau DM ke Social Media kita @Shopee_id / @Shopeecare ya. Sehat Selalu😊^HV",2024-04-29 21:17:54,3.20.10
632,e02e89d7-d9ec-40a2-8bec-dd27a4e74c6d,Reyza Putra,https://play-lh.googleusercontent.com/a-/ALV-UjWs5p0IfK_tV0SJCvHvGPSUdA-slWzJ8rsvkHVVJ82mRzlioMs,Aplikasi Benol Yang Baik..,5,0,3.24.17,2024-04-29 20:12:46,"Hi kak, makasih ya buat 5 bintangnya moga shopee bisa selalu memberikan kenyamanan dalam kakak berbelanja. terus setia pake shopee kalo ada pertanyaan/kendala terkait shopee Mohon hubungi kami dengan memberikan screenshot review ini melalui Live Chat atau DM ke Social Media kita @Shopee_id / @Shopeecare ya, have a nice day 😊^BA",2024-04-29 22:18:23,3.24.17
633,78352c87-6352-473b-b5f7-0f30176559fa,AHMAD RIFANDI,https://play-lh.googleusercontent.com/a/ACg8ocL1i-qXTGtquGiJnxis5kjzLrPou-nxd8HuCsqXMG3bYrMHbw=mo,"Puas beli di shopee.. Kerna toko yg bekerja sama dngan shopee, produk brang nya bagus dan bnyak toko² yg amanah jualan di shopee ini.. Mksih shopee..🙏😊",5,0,3.24.14,2024-04-29 20:12:40,,,3.24.14
634,970a0640-4eba-4dbe-9626-94ca2e9e708e,tiga rambu,https://play-lh.googleusercontent.com/a/ACg8ocJtiNIeqAyRC1ZkpUCYv7hJgk-vfP5SEjPw07pBsaq7InYfpw=mo,Sejauh ini sangat membatu banyak hal baik berbelanja maupun transakai lainnya .... terbaik.,5,0,2.51.30,2024-04-29 20:11:00,"Hai kak, makasih utk reviewnya. Mimin seneng deh kalo Shopee bs membantu kamu. Semoga Shopee selalu bs kasih pengalaman belanja terbaik utk kamu. Yuk kepoin promo-promo seru di aplikasi Shopee. Kalau kaka ada pertanyaan, bisa lampirkan SS review ini via Live Chat atau DM ke Social Media kita @Shopee_id / @Shopeecare ya. Sehat Selalu 😊^HV",2024-04-29 21:38:09,2.51.30
635,8aee9bd6-a23f-4cbc-a83f-2e1c156bc034,Guuss Puutu,https://play-lh.googleusercontent.com/a-/ALV-UjXvI7wtjvYI2O6nxaLMG2sMmlX6DTTL6qfI5Ft5KzXFdoW5imU,Pengiriman cepattt,4,0,3.24.14,2024-04-29 20:09:20,"Hallo kak, terima kasih banyak ya kak atas rating dan review nya, mimin tambah seneng banget nih klo bintangnya tambah lagi :) Kalo ada kendala terkait Shopee bisa lampirkan SS review ini melalui Live Chat atau DM ke Social Media kita @Shopee_id / @Shopeecare ya. Sehat Selalu😊^HV",2024-04-29 21:37:10,3.24.14
