,reviewId,userName,userImage,content,score,thumbsUpCount,reviewCreatedVersion,at,replyContent,repliedAt,appVersion
402,7f02668f-b586-4b0d-b216-761e8566bcf1,Gracia Agatha,https://play-lh.googleusercontent.com/a/ACg8ocIMG9OL83blOmzqf0U7jk8bXGRfjuH_XiIKwY5jwSFHchw9Mw=mo,"Menurutku ini Shopee udh bagus pengirimannya juga cepet ga lama yang aku pengen itu voucher nya tolong yaa voucher nya tolong di kasih setiap hari jangan setiap update aja kalo ga pake voucher itu bayarannya banyak bgt udh 1 lagi jangan ngelag"" pas apk ini mau di pencet makasii",3,0,3.24.17,2024-04-30 05:43:04,"hai ka, maaf atas ketidaknyamanannya. terkait gratis ongkir mimin saranin untuk cek penawarannya di ""Gratis Ongkir & Voucher"" serta sesuaikan S&K yang berlaku ya ka. jika ada pertanyaan atau kendala chat Live Chat atau DM TW @shopeeID stay safe🙏^MY",2024-04-30 06:13:47,3.24.17
403,0be1cc61-5796-4fb1-ad3a-469050fca48c,Lina KW,https://play-lh.googleusercontent.com/a/ACg8ocKaad3htEDeCxMqtQcybvBKTqooGPkuh2UYebETWDPh_-W7qw=mo,Mau chekout dr kemarin g bisa2,5,0,3.24.17,2024-04-30 05:40:29,Hai kak mohon maaf ya terkait kendala  checkoutnya pastikan sudah mematuhi syarat dan ketentuan Shopee utk di bantu boleh di infokan screeenshot kendala dan review ini di DM IG shopee_id. stay safe ^MY,2024-04-30 06:16:56,3.24.17
404,09c75ac1-28cc-4fe4-9d21-c51898b0f3a8,Harapin 1996,https://play-lh.googleusercontent.com/a-/ALV-UjWKbAJojyL0jsfelYbMXn3T6Cc2EjaNPlaLsz_2DRzF-clPgv4S,Mantap,4,0,3.20.10,2024-04-30 05:40:06,"Mantap nih kak, Terima kasih banyak ya atas feedbacknya. Yuk pantau terus aplikasi shopee untuk info promo menarik lainnya. kalo ada kendala terkait Shopee bisa DM aku di IG/twitter Shopee yaa, have a nice day💕^MY",2024-04-30 06:14:55,3.20.10
405,b9826a65-9fef-4306-8d28-e01360c191a5,Elin Meina,https://play-lh.googleusercontent.com/a-/ALV-UjUz32xhhypvPbBRvSLl69RMT0Wd9jzv-LWg319LWDqkrnZhoMI,Kenapa spay tidak masuk ya ?? Padahal transaksi berhasil,2,0,2.18.24,2024-04-30 05:29:05,"Hai kak mohon maaf ya terkait kendala top upnya bisa di tunggu 1x24 jam dari transaksinya ya ,  utk di bantu boleh di infokan screeenshot kendala dan review ini di DM IG shopee_id. stay safe ^MY",2024-04-30 06:19:34,2.18.24
406,1214b4c0-9379-4c05-91d2-87f9a595edf3,Ika Purwanti,https://play-lh.googleusercontent.com/a/ACg8ocKl_R3lbvmci6FJekC1keRAfKo-XN_QF7-YzWx7kPfxIk_BNw=mo,sangat cepat prosesnya,1,0,3.24.14,2024-04-30 05:16:37,"Hai kak, maaciw yaah udah selalu suka dan nyaman pakai Shopee, jgn lupa jga buat selalu ceki-ceki aplikasi Shopee km dan nikmati semua voucher, promo serta diskon yg ada yaa. Kalau ada pertanyaan terkait Shopee boleh kasih tau di DM IG shopee_id yaa, sehat selalu 😊^MY",2024-04-30 06:17:59,3.24.14
407,c7caf457-5aa7-40c0-a21f-aab91d63c235,GOFF,https://play-lh.googleusercontent.com/a-/ALV-UjUlqHJZgdj7jX_wBtij7OPZywcnUBh42eCVHd2bv9QFeUodbWdk,"Barang sdh sy kembalikan, tp duit masuk ke rekening penjual. Siapapun yg memutuskan dan yg menerima uang sy, akan mendapat musibah. Hanya soal waktu.",1,0,3.01.26,2024-04-30 05:14:00,,,3.01.26
408,82517d61-ce21-4d65-8170-6ff14a998624,Nizam Zam,https://play-lh.googleusercontent.com/a-/ALV-UjUt-r_KmH4fAtV4Bl2awdt9cjRwkDlqlt-9zsiMbiuH8JuVEc9T,sangat baik,3,0,3.24.14,2024-04-30 05:12:24,"Hai Kak, maaciw ya udah kasih penilaian buat Shopee, penilaianmu bikin aku makin semangat buat kasih pelayanan yang terbaik nih hihi pantau terus Shopee di sosial media nya & nikmatin promo yang berlangsung di aplikasi Shopee biar kamu makin nyaman😁 kalo ada kendala terkait Shopee bisa DM aku di IG/twitter Shopee yaa, have a nice day💕^MY",2024-04-30 06:21:57,3.24.14
409,e455d009-9a12-4d6d-97f3-e2fa08513ea9,Najwa Kamila,https://play-lh.googleusercontent.com/a-/ALV-UjXdYNZMyR6wLSVIL99uXvmmshMn42t0fJEWf11HJm1qu313as5r,Belanja lebih gampang,5,0,3.24.17,2024-04-30 05:11:36,"Hai kak, maaciw yaah udah selalu suka dan nyaman pakai Shopee, jgn lupa jga buat selalu ceki-ceki aplikasi Shopee km dan nikmati semua voucher, promo serta diskon yg ada yaa. Kalau ada pertanyaan terkait Shopee boleh kasih tau di DM IG shopee_id yaa, sehat selalu 😊^MY",2024-04-30 06:21:29,3.24.17
410,bf06dae0-5028-450c-87c2-3d4676137bfc,Anugerah Sipayung,https://play-lh.googleusercontent.com/a/ACg8ocKSQQGtlCMLhXZuDpotWtxtb92wMPW1pvomsxijHXJHab1Sxg=mo,Pngiriman barang sekarang lama sekali baru nyampe. Pesan tgl 22 sampe tgl 30 jga blm nyampe 🫣🤨🤨🤨,2,0,3.24.14,2024-04-30 05:11:31,"Hai kak, maaf ya. Terkait kendala pesanan, km dpt klik Perpanjang Masa Garansi/Ajukan Pengembalian jk pesanan blm dtg sampai waktu yg ditentukan. Terkait kendala akan shopee jadikan masukan utk menjadikan shopee lebih baik lagi. Mohon hubungi kami dgn memberikan SS kendala dan SS review ini via DM @Shopee_id. Stay healthy🙏🏻^YE",2024-04-28 13:46:24,3.24.14
411,b34f06c3-52fd-4c54-be27-0cbf3bce3a6f,Fitriatul Hasanah,https://play-lh.googleusercontent.com/a-/ALV-UjXe3QE6SYB0d9LFqmizBaNONztjcWbnLkW82A6BtArXOF2wNP8,"memuaskan 👍, semoga tambah sukses selalu, Aamiin Ya Robbal Aalaamiin...🤲🤲🤲👍👍👍",5,0,3.24.14,2024-04-30 05:09:53,"Hai kak, tengkyu bgt ya udah kasih bintangnya buat Shopee, mimin ikut seneng nihh jgn lupa buat pantau trs yuuk di sosmed Shopee utk info2 event dan promo kece lainnya, biar km ga ketinggalan. Kalo kamu ada kendala bisa colek mimin di DM IG @shopeecare_id. Have a great day kak :) ^MY",2024-04-30 06:20:58,3.24.14
412,26412831-f5c2-426b-b67a-87c8dd3f1f9f,Moh.Taufiq Hidayat,https://play-lh.googleusercontent.com/a-/ALV-UjWoNEF1arhRQp_Atia2a-qa9b-YMEkqzNGPUmIJ3wuydUx4EZop,👍👍,5,0,3.24.14,2024-04-30 05:07:52,"Hai kak, tengkyu bgt ya udah kasih bintangnya buat Shopee, mimin ikut seneng nihh jgn lupa buat pantau trs yuuk di sosmed Shopee utk info2 event dan promo kece lainnya, biar km ga ketinggalan. Kalo kamu ada kendala bisa colek mimin di DM IG @shopeecare_id. Have a great day kak :) ^MY",2024-04-30 06:23:20,3.24.14
413,c64615f1-5d58-4831-ae1a-3ce04c409fa4,Siti Hadijah,https://play-lh.googleusercontent.com/a-/ALV-UjXDsivjWoSJvP5uLzJK4ohsGSSjWn-zUSWZDTqswhf-WsCyLmw,Aplikasi shopping terbaik deh menurut ku,5,0,3.24.14,2024-04-30 04:59:48,"Hi Kak, terima kasih komentar dan bintangnya. Mimin jadi makin semangat buat kasih pelayanan yg terbaik untuk semua pengguna Shopee. Kalau ada pertanyaan terkait Shopee jangan sungkan DM mimin di @Shopee_id / @Shopeecare ya, Selamat beraktivitas 😊^ES",2024-04-30 05:34:19,3.24.14
414,dc7fc4e9-c27a-4671-a2fe-79088136032e,Ike Gyandra,https://play-lh.googleusercontent.com/a/ACg8ocKB1gz2a9a3iAv7M_WlHqxo9_KFDUk2SJWd0n7ZYZ8qbdC1Rg=mo,Top markotop 🙌🙌🙌🙌,4,0,,2024-04-30 04:50:34,"Keren nih kak, Terima kasih banyak ya atas feedbacknya. Yuk pantau terus aplikasi shopee untuk info promo menarik lainnya. kalo ada kendala terkait Shopee bisa DM aku di IG/twitter Shopee yaa, have a nice day💕^MY",2024-04-30 05:17:08,
415,b0b5b12d-c90e-41c0-8558-d466ee21207d,M. Nurhadi Ihsan,https://play-lh.googleusercontent.com/a-/ALV-UjUWEE_U7wepbSE8xxWxA1D36vHBHteAuP-17SfHrouPDD3KMAcQ,Mantap,5,0,3.23.36,2024-04-30 04:42:57,"Hi kak, makasih ya buat bintang 5 nya, mimin tambah semangat nih buat kasih pelayanan yg terbaik :) Yuk pantau terus aplikasi Shopee biar nggk ketinggalan promo menarik lainnya ya. Klo ada pertanyaan terkait Shopee colek DM mimin di @Shopee_id / @Shopeecare ya, Selamat beraktivitas 😊^ES",2024-04-30 05:32:48,3.23.36
416,014e9ad0-843b-47d5-a5fa-a63baceac2d8,Trisye Andarisah,https://play-lh.googleusercontent.com/a/ACg8ocIZh05gRJRtPZd0tbQ8udAqSsUCarHcGbmPgT_Vpku_WivIWQ=mo,Terbaik,5,0,3.24.14,2024-04-30 04:33:11,"Hi kak, makasih ya buat bintang 5 nya, mimin tambah semangat nih buat kasih pelayanan yg terbaik :) Yuk pantau terus aplikasi Shopee biar nggk ketinggalan promo menarik lainnya ya. Klo ada pertanyaan terkait Shopee colek DM mimin di @Shopee_id / @Shopeecare ya, Selamat beraktivitas 😊^ES",2024-04-30 05:22:32,3.24.14
417,da81ad6a-4eb8-49ff-a334-34d574e97120,Atari Luthfia Rahmi,https://play-lh.googleusercontent.com/a-/ALV-UjVJWrqRn8emKxJY7_zC7I1n9FOM1CLE3mIk_7CPW6Ht8s7Ej5cbXg,Kenapa jadi ga bisa buka tautan shopee ya? Cuma mentok sampe home page,3,0,3.24.17,2024-04-30 04:21:20,"Hai kak mohon maaf ya terkait kendala aplikasinya, aku saranin kamu bisa clear cache, update aplikasi Shopee, internet yang stabil, dan lakukan berkala 1x24 jam. utk di bantu boleh di infokan screeenshot kendala dan review ini di DM IG shopee_id. stay safe ^MY",2024-04-30 05:15:03,3.24.17
418,e289da1c-1995-49e8-a258-71fa54d7ce01,dady sand,https://play-lh.googleusercontent.com/a-/ALV-UjVclKmC4oljXmivZqLazKtzsPo7peDRTyI0fzxj_udYK8M8Cy3f,"Hati hati didalam aplikasi ini mengandung banyak permainan, contoh permainan antar penjual, jasa pengirim dan pihak shopee sendiri agar uangmu terjebak di shopeepay dengan membuat masalah pada proses pengiriman. Dana kembali namun saat anda ingin menarik dana anda kembali dikenakan admin 2500. Itu sebagian kecil dari permainan 3 unsur yang saya ungkap disini. Mau beli barang kena admin dari mau narik juga kena admin. Biaya penanganan 1000 kaya lah shopee ini dengan cara begini",1,0,2.38.30,2024-04-30 04:19:26,,,2.38.30
419,c474b7eb-4fe0-4e1e-8c85-5263cdebe46c,Zainal Arif,https://play-lh.googleusercontent.com/a-/ALV-UjX-8SdgNLx_x-uiYOSCQYP15kHrHMpsJD6g7s-P6lbdvs-IQKuZ,"Pengaturan pembayaran shoppe affiliate di tolak terus , juga terlalu ribet. Jadi nya komisi gak bisa di tarik., Gak kayak TIKTOK tarik komisi mudah gak ribet,. Jadi buat apa udah susah2 jadi affiliate malah gak bisa di ambil komisi nya. .,",1,0,3.24.14,2024-04-30 04:13:21,Hai kak mohon maaf ya terkait kendala pembayaran shopee affiliate yg di tolak  utk di bantu boleh di infokan screeenshot kendala dan review ini di DM IG shopee_id. stay safe ^MY,2024-04-30 05:14:18,3.24.14
420,41a94c7a-f8ac-431b-99dc-0e194e65513d,muhammaddeyie Aldean,https://play-lh.googleusercontent.com/a-/ALV-UjWr28dhb05XDRz4SxEfdRKdW51pNnWhOwMun1sAt9rquGmNhb4,Ongkir tak terbatas Cuman saran iklan jangan banyak x di apk lain,4,0,3.24.14,2024-04-30 04:09:43,,,3.24.14
421,f4f4d75d-6d92-4f7b-823e-8d8a5a42db88,Ardi Pragowo,https://play-lh.googleusercontent.com/a-/ALV-UjUiNrJnTkm7bjAL_rMDL6Nv0nMhj6-YdjrbprOz3w5L4EOJDtE,Sangat puas👍👍👍👍👍👍👍👍👍,5,0,3.24.17,2024-04-30 04:04:31,Hi kak makasih ya buat bintang dan reviewnya. seneng banget mimin baca review km. Setia terus belanja di Shopee yaaa. klo ada pertanyaan jgn ragu buat infoin ke mimin di DM IG @shopee_ID ya. semoga harimu menyenangkan😊 ^PY,2024-03-08 05:06:56,3.24.17
422,09d6a0c9-2e95-4c61-a7d0-4f67a312fd39,Dani Sulistianto,https://play-lh.googleusercontent.com/a/ACg8ocI4lnc6IJeg3ivQydl0MtbkIFT72bmiONBRhroVauJ6ELUL8g=mo,Kaga bisa di gunain paylater nya,1,0,3.24.17,2024-04-30 03:49:39,"Hi kak, maaf ya udh buat risau terkait kendala tidak bisa menggunakan SpayLater. Mimin Pastiin kamu selalu melakukan pembayaran tepat waktu sebelum jatuh tanggal tempo pada SpayLater dan Spinjam ya kak. Untuk pengecekan lebih lnjut boleh infoin username dan SS detail kendala kamu ke DM @Shopee_id / @Shopeecare ya. Stay safe🙏^BO",2024-04-30 04:18:47,3.24.17
423,3f71a4d3-5c62-4958-8f2a-3f4ea938735c,Juli Lie,https://play-lh.googleusercontent.com/a/ACg8ocLCf0nH_pEFjo389sT-5Lc9DS3_IR2kaISeVb4yFswKISjfsQ=mo,Jangantapil agi,1,0,,2024-04-30 03:45:16,,,
424,4c0d0268-550d-4339-ae33-eb9a0c72383f,Nina Agustina,https://play-lh.googleusercontent.com/a-/ALV-UjVu6q_2BJ2jWC7sWQwWh-QhrmYobIxYFu6lRm_rKPRzq2GvkNhV,good,5,0,3.22.50,2024-04-30 03:26:30,"Haii kak, maacih yaa buat review bintang 5 nya, yuk pantengin terus updatean dari sosmed resminya shopee dan aplikasi shopee yaa. Kalo ada kendala/pertanyaan lainnya bisa DM ke Social Media kita @ShopeeID/@Shopeecare. Stay safe🙏🏾^BO",2024-04-30 04:17:21,3.22.50
425,32021ba5-399c-436a-a75f-670fde9bf4ec,dayko 90,https://play-lh.googleusercontent.com/a-/ALV-UjWxe5gNrQRHjIqR8qYpZJzrPOxGE4Zko-IeXVfex_IcZxeHmcWm,"kebijakaan yang sangat merugikan pihak pembeli,pengelolan yang sangat buruk,pelayanan sangat kurang",1,0,3.24.14,2024-04-30 03:23:56,,,3.24.14
426,318e0ce5-53ef-4536-962a-4a1609d8427a,Kelvin Andrewibowo,https://play-lh.googleusercontent.com/a/ACg8ocJaTRGYTL0kcqLY-V6knPMdPx-PpyoDyFhCfq12v8Qjf4DaSA=mo,tolong pihak kominfo..menghapus aplikasi pinjol .karna semua aplikasi pinjol aplikasi .yg mencekek para 2 masarakat dengan iming 2 pinjaman. mura teryata semua mencekek bunga y..menegerikan .6 jt jadi 8 jt 800. ni gimana pemerinta pihak kominfo bisa.merilis aplikasi .linta darat seperti aplikais pinjol ..tolong di hapus dan di stop...semoga. pak prabowo. menutup aplikasi pinjol secepat mungkin,1,1,3.21.13,2024-04-30 03:21:31,"Hi kak maaf yaa udah buat resah. Boleh yuk kak pastiin, akun Shopee kakak dalam versi terbaru dan jaringan internet kakak stabil. Boleh coba clear cache aplikasi Shopee nya yaa. Coba berkala kak 1x24 jam, jk ada yg bingung, boleh menghubungi kami lwt Live Chat ya kak detailnya klik klik https://shp.ee/9ddcsh5 terima kasih 🙏 ^UL
",2022-09-24 04:05:16,3.21.13
427,3a3e8e3e-d247-449b-bfcb-88531bc6b256,Cecep saepul Rohman,https://play-lh.googleusercontent.com/a/ACg8ocKn1kJN7wSbsW3eZmtmcNRS7Y0niRjkreP9UjLMgPuLO57KuA=mo,Woy iklan lu ganggu Mulu tuh di YouTube,5,0,,2024-04-30 03:19:34,"hi kak, maaf ya buat kamu gak nyaman terkait kendala iklan yg mengganggu, mimin infoin iklan shopee bertujuan utk infoin update promo yg sdg berlgsg ya ka. biar bisa mimin bantu pengecekan mohon hubungi mimin dgn lampirin screenshot review ini lewat Live Chat atau DM ke Media Sosial @Shopee_id / @Shopeecare ya. stay fit🙏 ^BO",2024-04-30 04:16:06,
428,7c6df1c8-188d-4962-98e6-3fc2bc78f9f9,kamit budiutomo,https://play-lh.googleusercontent.com/a-/ALV-UjU6X65i4K9VwQTz8VanWTfizTYps_s0Madg6wxa8y9L7IeNbjc6,is the best.... pengguna setiaku,5,0,3.24.14,2024-04-30 03:03:09,"Haii kak, maacih yaa buat review bintang 5 nya, yuk pantengin terus updatean dari sosmed resminya shopee dan aplikasi shopee yaa. Kalo ada kendala/pertanyaan lainnya bisa DM ke Social Media kita @ShopeeID/@Shopeecare. Stay safe🙏🏾^BO",2024-04-30 04:14:23,3.24.14
429,98e68f5b-2e71-48d4-812f-b8c5bd47cc87,Roidah Ida,https://play-lh.googleusercontent.com/a/ACg8ocIFh1R-VTI__7_MOCv2Hzk1zXMXF3QZdNxXf2LTsON5CUSUQQ=mo,Lebih murah kualitas y jg ok,5,0,3.21.16,2024-04-30 03:01:47,"Haii kak, maacih yaa buat review bintang 5 nya, yuk pantengin terus updatean dari sosmed resminya shopee dan aplikasi shopee yaa. Kalo ada kendala/pertanyaan lainnya bisa DM ke Social Media kita @ShopeeID/@Shopeecare. Stay safe🙏🏾^BO",2024-04-30 04:13:46,3.21.16
430,78f9a293-12e5-4f47-b259-3b42fdc06558,Zulkarnia krasid,https://play-lh.googleusercontent.com/a/ACg8ocK-GM9F-sA05lsjXIV7ok0HbtZ0TYrz85FyYG9b2zqkCdFKCw=mo,debes deh,3,0,3.20.10,2024-04-30 02:40:05,"Hai kak ,makasih ya buat bintang nya. Tapi kalo kakak puas dengan pelayanan shopee, boleh dong bintangnya ditambahin biar makin sempurna. Kalo ada pertanyaan terkait shopee bisa Dm IG @Shopee_ID ya. Stay safe 🙏^BO",2024-04-30 03:15:46,3.20.10
431,ed6457ff-1960-4b54-acb0-cf326bd9026e,ulpa nurpadila,https://play-lh.googleusercontent.com/a-/ALV-UjWxiEgCDKapIFGNEshKeNznEbcs9NfucjL4TUen28PXHJAgi0pnAA,"Kena tipu belanja pake pay later, barang gak dateng harus ttp bayar cicilan. Toko d Shopee sdh diblokir mau komplen gimana tokonya udh gak ada. Minta alamat toko gak dikasih. Cicilan sampe 4jt lebih cuma mau ngasih vocer 500rb. Minta bantu hubungin penjual cukup bilang gak ada respon. Masa iyah gak punya karyawan buat nyari itu orang yg dah nipu???? Sebelum buat toko bukannya dftr, mungkin alamat, ktp, apalah semua ada. Jd males belanja lg. Apalagi harus bayar angin 12x.",1,0,3.16.20,2024-04-30 02:38:31,"Hi kak, maaf ya bikin kakak gk nyaman terakit kendala yang kakak alami. untuk lebih detailnya kakak bisa infoin username dan detail kendala kakak melalui DM ke @ShopeeID @ShopeeCare. Ditunggu 🙏 ^ES",2024-04-30 03:11:44,3.16.20
432,d1df927e-3615-408c-9115-745f0d1fc254,MUHAMMAD IHSYAN,https://play-lh.googleusercontent.com/a-/ALV-UjVAuWEVuHSsPDSo8qZWWQSGGrIMtn4g9fBHi7Vt5VIMBi_CKJA,Sangat mmbntu ktika daeurat,5,0,3.16.20,2024-04-30 02:38:02,"Hai kak, maaciw yaah udah selalu suka dan nyaman pakai Shopee, jgn lupa jga buat selalu ceki-ceki aplikasi Shopee km dan nikmati semua voucher, promo serta diskon yg ada yaa. Kalau ada pertanyaan terkait Shopee boleh kasih tau di DM IG shopee_id yaa, sehat selalu 😊^MY",2024-04-30 03:09:16,3.16.20
433,bcc5da99-1735-496d-8962-8fcf80668327,Wahyuni Yuni,https://play-lh.googleusercontent.com/a/ACg8ocIl1ClC4sCe1COVms7J2a2injs96R25LmcqEjEppMGf5ftnvg=mo,Fitur bagus,5,0,3.24.17,2024-04-30 02:19:51,"Haii kak, maacih yaa buat review bintang 5 nya, yuk pantengin terus updatean dari sosmed resminya shopee dan aplikasi shopee yaa. Kalo ada kendala/pertanyaan lainnya bisa DM ke Social Media kita @ShopeeID/@Shopeecare. Stay safe🙏🏾^BO",2024-04-30 03:13:03,3.24.17
434,d6ce0a3c-b6e3-4bca-a329-e701191c13f1,Gopar Kie,https://play-lh.googleusercontent.com/a-/ALV-UjUVRRBiGyKF9SxNC_6b8ScEmEi6OggQOKNS_LrVh32_zsZPQZH0,"aplikasi super lemot, mau belanja malah jadi emosi",1,0,3.24.17,2024-04-30 02:18:11,"Hi kak maaf ya terkait kendala Aplikasi , mimin saranin kakak untuk Clear Cache dan menunggu 1x24jam. jika kakak masih terkendala setelah 1x24jam bisa infoin Username dan kendala melalui DM ke @ShopeeID @ShopeeCare. Sehat selalu 🙏 ^ES",2024-04-30 03:12:32,3.24.17
435,aac51471-abe3-46d1-b6f9-88ff7abac148,Gustin Jaya,https://play-lh.googleusercontent.com/a/ACg8ocLSeOFecSIzFNsKkASg-Bbnnw4dO40Q2AoYq72YcE7LmMWZkg=mo,mantap pokonya,5,0,3.23.36,2024-04-30 02:17:02,"Hi kak, makasih ya buat bintang 5 nya, mimin tambah semangat nih buat kasih pelayanan yg terbaik :) Yuk pantau terus aplikasi Shopee biar nggk ketinggalan promo menarik lainnya ya. Klo ada pertanyaan terkait Shopee colek DM mimin di @Shopee_id / @Shopeecare ya, Selamat beraktivitas 😊^ES",2024-04-30 03:09:50,3.23.36
436,df46d890-59ba-45f8-a5b5-534815949a7a,Mhammad Yusuf,https://play-lh.googleusercontent.com/a/ACg8ocKHBbsf32kfN8BlwHEGETduSIe9pj5MMnlreb7ws7ob2IJT0g=mo,Kenapa pengaktifan Shopee paylater ku di tolak terus padahal SDH langganan dengan shope kecewa sekali saya dengan shopee,1,0,3.23.35,2024-04-30 02:13:02,Hai kak mimin memahami kendala Kakak terkait aktivasi fitur SPayLater yang belum berhasil. utk di bantu boleh di infokan screeenshot kendala dan review ini di DM IG shopee_id. stay safe ^MY,2024-04-30 03:12:00,3.23.35
437,9b15f410-dfec-4a39-bc2c-7432a57b5ea8,Purwanto Ragil,https://play-lh.googleusercontent.com/a/ACg8ocLHJsv2VocaoAHTaGQbmFXwxa00A3wt8dACQuZNDflSbFNDyQ=mo,"Sangat di permudah untuk belanja,pelayanan oke,top deh shopee sukses selalu🙏👍",5,0,3.20.10,2024-04-30 02:10:02,"Haii kak, maacih yaa buat review bintang 5 nya, yuk pantengin terus updatean dari sosmed resminya shopee dan aplikasi shopee yaa. Kalo ada kendala/pertanyaan lainnya bisa DM ke Social Media kita @ShopeeID/@Shopeecare. Stay safe🙏🏾^BO",2024-04-30 03:13:16,3.20.10
438,db56c7be-fb6f-40d0-9702-b6f121bdc047,Ferdian Agung,https://play-lh.googleusercontent.com/a-/ALV-UjXQaMZ049YYmdigV_fFiRiOTjGWpRdrEI7TQpoPde08lRPKS3U,Tidak bisa login akun udah 4 hari...,1,0,3.24.17,2024-04-30 02:07:33,hi kak mohon maaf udh buat ga nyaman 🙏 pastikan kamu menggunakan data data yg benar ketika login seperti username dan password yg tepat. agar bisa aku cek mohon infokan SS kendlaanya ke DM sosmed resmi shopee ya ditunggu 🙏^MY,2024-04-30 03:08:42,3.24.17
439,f3234d31-27fc-4910-9a0b-2217e360c6e4,Dani P123,https://play-lh.googleusercontent.com/a/ACg8ocIUZ7oggYh9bbDwYrEjDrCjMTvgcuX8pEN1hXkeFzoZPiJ-Xw=mo,Sangat membantu di kehidupan sehari-hari,5,0,3.24.17,2024-04-30 02:05:36,"Haii kak, maacih yaa buat review bintang 5 nya, yuk pantengin terus updatean dari sosmed resminya shopee dan aplikasi shopee yaa. Kalo ada kendala/pertanyaan lainnya bisa DM ke Social Media kita @ShopeeID/@Shopeecare. Stay safe🙏🏾^BO",2024-04-30 03:10:54,3.24.17
440,e20a263c-d759-4221-bec9-3d9b9f895de9,Adnan Xybys,https://play-lh.googleusercontent.com/a-/ALV-UjWllWlDKZrZklhNC6OQVznPHjlRBeY09dNcjVBWZ7rXRzMs1f0,"Shopee bodh, aplikasi lemot susah untuk belanja hapus aja ini aplikasi gk guna Apalah shopee lemot banget padahal sinyal bagusss aplikasi apa ini masa kaya gini jelek bangett kaya yang bikin",2,0,3.24.14,2024-04-30 01:55:04,,,3.24.14
441,5ea100de-7276-4b36-93fa-a44ff2e94ac7,Ar Ief,https://play-lh.googleusercontent.com/a/ACg8ocLJbxVLc74ll_N3UFwW29rI0MeXlyscbZjO3QhNBWgchG6RBw=mo,Kren,5,0,,2024-04-30 01:48:48,"Keren nih kak, Terima kasih banyak ya atas feedbacknya. Yuk pantau terus aplikasi shopee untuk info promo menarik lainnya. kalo ada kendala terkait Shopee bisa DM aku di IG/twitter Shopee yaa, have a nice day💕^MY",2024-04-30 02:10:31,
442,957a57dc-5d29-46d1-987d-a5d3c0f806d3,Le Li,https://play-lh.googleusercontent.com/a/ACg8ocL67MhOMIGOMK8_y1oOpsnRX1Sbykq7eAhXi9Z1ph53E3MEEg=mo,bagus baik,5,0,3.24.14,2024-04-30 01:45:40,"Hi Kak, terima kasih komentar dan bintangnya. Mimin jadi makin semangat buat kasih pelayanan yg terbaik untuk semua pengguna Shopee. Kalau ada pertanyaan terkait Shopee jangan sungkan DM mimin di @Shopee_id / @Shopeecare ya, Selamat beraktivitas 😊^ES",2024-04-30 02:32:09,3.24.14
443,748e4825-8fe0-4670-89f9-22a5c25aabb7,Erwin Tauhit,https://play-lh.googleusercontent.com/a-/ALV-UjXVyBw781XnKsSvXNNzhRBklVbvs8GcoTswTaUIrhHMjUPGcXY,cukup baik,5,0,3.24.17,2024-04-30 01:37:55,"Hii kak, makasih ya buat review bintang 5 nya, yuk cek aplikasi shopee biar gak ketinggalan promo-promo menarik lainnya. Kalo ada kendala/pertanyaan lainnya bisa DM ke Social Media kita @ShopeeID/@Shopeecare. Stay safe🙏🏾^BO",2024-04-30 02:09:57,3.24.17
444,b9c0d390-c3d4-482c-9338-84504bece3a6,Ipoel C40t,https://play-lh.googleusercontent.com/a-/ALV-UjWA5LAkrYuLBSzySng_H2Daw3W22FBbvRwoqc7sJUp1kpSsHOo,Limid shopepaylater hilang sendirinya jika masih ada sisa.... Dan tidak ada kemajuan limidnya walaupun bayar tepat waktu.... Bertahun2 pake shopey jadi makin kecewa dngn aplikasinya.,1,0,,2024-04-30 01:36:24,Hai kak mohon maaf ya terkait kendala limit yg hilang  utk di bantu boleh di infokan screeenshot kendala dan review ini di DM IG shopee_id. stay safe ^MY,2024-04-30 02:09:47,
445,1c636ba0-3b4f-40dc-a76a-8d0bb95c52f1,Kenita Aprilia,https://play-lh.googleusercontent.com/a/ACg8ocJg43GqqzvCMOuk5wiMrXC9FplYFgATigjVGcgFnbMeE5-urw=mo,Shopee kebijakan nya di perhatikan toko fav aku pd off jualan di shopee pdhl udh enak beli shopee,2,0,3.23.32,2024-04-30 01:35:05,"Hi kak maaf ya bikin kamu gk nyaman terkait kendala kamu, masukan dari Kakak akan Mimin jadikan acuan untuk menjadikan Shopee lebih baik lagi. Mimin selalu mencoba memberikan yang terbaik untuk para pengguna Shopee. Kalau ada pertanyaan terkait Shopee jangan sungkan DM mimin di @Shopee_id / @Shopeecare ya, Selamat beraktivitas ^ES",2024-04-30 02:29:18,3.23.32
446,a6befb54-9197-4f20-83dc-77678ccfbc44,yulian cahyo,https://play-lh.googleusercontent.com/a-/ALV-UjV_O4yvqsdurtM3lRlfrCj0Hp7iW9dB-Y2KxM4xT5Z7Iyvk3RFUYQ,Emboh lah,5,1,3.23.32,2024-04-30 01:34:11,"Halo kak, maaf ya kak udah bikin ngga nyaman terkait aplikasi. Mimin saranin buat clear cache, relogin dan pastikan jaringan stabil ya kak. Jika masih ada kendala bisa hubungi mimin lagi dgn screenshot review ini melalui live chat/DM ke social media di @Shopee_id / @Shopeecare. Sehat selalu ^XO",2024-03-15 16:26:55,3.23.32
447,fb9991f0-966e-4716-a6da-0cbbef16b19d,Paman Sem,https://play-lh.googleusercontent.com/a/ACg8ocL2i5T8VBeYhqzapboaThx0krgpryvflQCzP0lvTQ_wGqmL=mo,Puas,5,0,,2024-04-30 01:29:48,"Hii kak, makasih ya buat review bintang 5 nya, yuk cek aplikasi shopee biar gak ketinggalan promo-promo menarik lainnya. Kalo ada kendala/pertanyaan lainnya bisa DM ke Social Media kita @ShopeeID/@Shopeecare. Stay safe🙏🏾^BO",2024-04-30 02:08:30,
448,78a824d8-1a84-440a-adc5-3e8f7b71b4fc,Fauzi Ahmad,https://play-lh.googleusercontent.com/a/ACg8ocJbJbXgVwJqbO_WFguWp5nRz-8qOabL_9iUfrRSv4Yb3lvX=mo,"Bad, semakin hari app makin gede, Utk pelayanan overall bagus",1,0,3.24.17,2024-04-30 01:24:06,"Hai kak, makasih banget ya kak buat bintang dan reviewnya. Saran dari kamu akan jadi masukan buat kami untuk kedepannya bisa memberikan pelayanan yg lebih baik lagi. Jika ada kendala bisa hubungi kami melalui Live Chat atau DM ke Social Media kita @Shopee_id / @Shopeecare ya. Makasih:) ^MY",2024-04-30 02:08:44,3.24.17
449,707a0f1c-d0ab-4175-9716-77b9202d5b3a,Didin Saripudin,https://play-lh.googleusercontent.com/a-/ALV-UjXUbNjWBcZLVNZrzz4uUfe0xG_S-lKR2SGh-POrFXcTeUD5S2M,Bagus,5,0,3.24.14,2024-04-30 01:20:23,"Hi kak, makasih ya buat bintang 5 nya, mimin tambah semangat nih buat kasih pelayanan yg terbaik :) Yuk pantau terus aplikasi Shopee biar nggk ketinggalan promo menarik lainnya ya. Klo ada pertanyaan terkait Shopee colek DM mimin di @Shopee_id / @Shopeecare ya, Selamat beraktivitas 😊^ES",2024-04-30 02:28:00,3.24.14
450,0698dc82-f3fa-45bd-a1ee-080582b32aa7,Child Fox Moba,https://play-lh.googleusercontent.com/a-/ALV-UjV_gEGupRCxMt5aqcDSHWTyw8Bdi2-DZC854VL4ds6vqGRQwZM,"Paylater susah di netralkan, semenjak di nekukan",1,0,3.19.12,2024-04-30 01:20:01,"Hi kak, maaf ya udh buat risau terkait kendala tidak bisa menggunakan SpayLater. Mimin Pastiin kamu selalu melakukan pembayaran tepat waktu sebelum jatuh tanggal tempo pada SpayLater dan Spinjam ya kak. Untuk pengecekan lebih lnjut boleh infoin username dan SS detail kendala kamu ke DM @Shopee_id / @Shopeecare ya. Stay safe🙏^BO",2024-04-30 02:07:28,3.19.12
